{
  "eventId": "evt-worker-3-ws-ready",
  "workerExecutionId": "123e4567-e89b-12d3-a456-426614174020",
  "workItemId": "123e4567-e89b-12d3-a456-426614174001",
  "sequence": 3,
  "type": "workspace_ready",
  "occurredAt": "2024-01-02T12:00:02Z",
  "payload": { "worktreePath": "/var/shipit/workers/worker-local-1/exec-123/worktree" }
}